{
  "metadata": {
    "title": "Trading Agent Dashboard Architecture Mirror",
    "version": "2026-07-21-architecture-mirror-v1",
    "generated_from": [
      "HANDOFF_BRIEF.md",
      "README.md",
      "docs/CURRENT_STATE.md",
      "exports/master_orchestrator.json",
      "exports/dashboard_writer.json",
      "exports/layer2_trade_selection_agent.json",
      "script.js",
      "index.html",
      "playwright-dashboard-smoke.js",
      "data/workflow-status.json"
    ],
    "last_verified_at": "2026-07-21",
    "notes": [
      "This manifest documents architecture only. It must not change production logic, research logic, workflow execution, or artifact semantics.",
      "Explicitly uncertain relationships remain marked unverified instead of being inferred into verified flow."
    ]
  },
  "boundaries": [
    {
      "id": "browser_surface",
      "label": "Browser Surface",
      "description": "Static GitHub Pages UI rendered by index.html, styles.css, script.js, and shared browser-side helpers."
    },
    {
      "id": "github_publication",
      "label": "GitHub Publication",
      "description": "Checked-in JSON artifacts and static files served from the repository through GitHub Pages."
    },
    {
      "id": "n8n_runtime",
      "label": "n8n Runtime",
      "description": "Live orchestration and workflow execution inside the n8n workspace."
    },
    {
      "id": "supabase_runtime",
      "label": "Supabase Runtime",
      "description": "Canonical runtime storage for market snapshots, agent outputs, and economic events."
    },
    {
      "id": "research_stack",
      "label": "Research Stack",
      "description": "Downstream-only replay, evaluation, checker, and derived research artifact generation."
    }
  ],
  "legends": [
    {
      "id": "verification-statuses",
      "title": "Verification Statuses",
      "items": [
        {
          "label": "Verified",
          "description": "Directly supported by current repository files, exports, or runtime artifacts."
        },
        {
          "label": "Partially Verified",
          "description": "High-level component or path is supported, but exact implementation boundaries remain incomplete."
        },
        {
          "label": "Unverified",
          "description": "Called out intentionally as uncertain and left explicit rather than assumed."
        }
      ]
    },
    {
      "id": "edge-meanings",
      "title": "Relationship Meanings",
      "items": [
        {
          "label": "Reads / Consumes",
          "description": "Downstream component reads data or artifacts produced elsewhere."
        },
        {
          "label": "Writes / Publishes",
          "description": "Component emits a checked-in artifact or runtime table update."
        },
        {
          "label": "Triggers",
          "description": "Execution control path, not a data transformation."
        }
      ]
    },
    {
      "id": "boundary-meanings",
      "title": "Boundary Regions",
      "items": [
        {
          "label": "Browser",
          "description": "Read-only UI and browser-derived presentation logic."
        },
        {
          "label": "Runtime",
          "description": "Live orchestration, collectors, agents, and runtime data stores."
        },
        {
          "label": "Research",
          "description": "Historical analysis stack that must stay downstream-only."
        }
      ]
    }
  ],
  "nodes": [
    {
      "id": "github_pages",
      "label": "GitHub Pages",
      "short_label": "Pages",
      "kind": "Host",
      "summary": "Serves the static dashboard and checked-in JSON artifacts from the repository root.",
      "details": "Current hosting is GitHub Pages, not Netlify. The dashboard loads index.html, styles.css, script.js, and checked-in data files from the repository.",
      "files": [
        "docs/CURRENT_STATE.md",
        "README.md",
        "index.html"
      ],
      "verification": {
        "status": "verified",
        "evidence": "docs/CURRENT_STATE.md and README.md identify GitHub Pages as the active host.",
        "notes": []
      }
    },
    {
      "id": "dashboard_renderer",
      "label": "Dashboard Renderer",
      "short_label": "Renderer",
      "kind": "Browser Code",
      "summary": "Renders live production cards and read-only research tabs from published artifacts and Supabase research views.",
      "details": "script.js loads layer1.json, layer2.json, workflow-control.json, workflow-status.json, local research artifacts, and selected research Supabase views. Browser-side Layer 2 confidence is re-derived from Layer 1 headline confidence.",
      "files": [
        "index.html",
        "script.js",
        "styles.css",
        "backtester/lib/headline_confidence.js",
        "backtester/lib/layer2_pair_logic.js"
      ],
      "verification": {
        "status": "verified",
        "evidence": "index.html and script.js define the static UI and data-loading behavior.",
        "notes": []
      }
    },
    {
      "id": "dashboard_browser",
      "label": "Operator Browser",
      "short_label": "Browser",
      "kind": "Consumer",
      "summary": "Receives the rendered dashboard surface and can trigger the orchestrator through the published webhook control contract.",
      "details": "The browser never receives the n8n API key. It works through workflow-control.json and the published status/data artifacts.",
      "files": [
        "index.html",
        "script.js",
        "data/workflow-control.json"
      ],
      "verification": {
        "status": "verified",
        "evidence": "script.js triggers the webhook from workflow-control.json and polls workflow-status.json.",
        "notes": []
      }
    },
    {
      "id": "workflow_control_json",
      "label": "data/workflow-control.json",
      "short_label": "workflow-control.json",
      "kind": "Published Artifact",
      "summary": "Contains the non-secret webhook configuration used by the browser to trigger the Master Orchestrator.",
      "details": "The dashboard uses this checked-in file so the browser can trigger runs without exposing the n8n API key.",
      "files": [
        "data/workflow-control.json",
        "script.js",
        "HANDOFF_BRIEF.md"
      ],
      "verification": {
        "status": "verified",
        "evidence": "HANDOFF_BRIEF.md and script.js both describe workflow-control.json as the trigger contract.",
        "notes": []
      }
    },
    {
      "id": "workflow_status_json",
      "label": "data/workflow-status.json",
      "short_label": "workflow-status.json",
      "kind": "Published Artifact",
      "summary": "Published run-status artifact consumed by the dashboard for workflow health, steps, and failure reporting.",
      "details": "The latest checked-in runtime artifact shows a successful run on 2026-07-20 with Layer 2 Trade Selection Agent included.",
      "files": [
        "data/workflow-status.json",
        "script.js",
        "exports/master_orchestrator.json"
      ],
      "verification": {
        "status": "verified",
        "evidence": "data/workflow-status.json and exports/master_orchestrator.json show the status payload contract.",
        "notes": []
      }
    },
    {
      "id": "layer1_json",
      "label": "data/layer1.json",
      "short_label": "layer1.json",
      "kind": "Published Artifact",
      "summary": "Published Layer 1 dashboard artifact containing sealed raw-call presentation data.",
      "details": "Current production cards, expiry presentation, and tooltip contract render from this checked-in artifact.",
      "files": [
        "data/layer1.json",
        "exports/dashboard_writer.json",
        "script.js"
      ],
      "verification": {
        "status": "verified",
        "evidence": "dashboard_writer.json writes data/layer1.json and script.js renders it directly.",
        "notes": []
      }
    },
    {
      "id": "layer2_json",
      "label": "data/layer2.json",
      "short_label": "layer2.json",
      "kind": "Published Artifact",
      "summary": "Published raw Layer 2 pair-selection artifact used as upstream display input.",
      "details": "The browser still re-derives live pair confidence and strength from Layer 1 headline confidence instead of trusting every upstream Layer 2 payload field.",
      "files": [
        "data/layer2.json",
        "exports/layer2_trade_selection_agent.json",
        "script.js"
      ],
      "verification": {
        "status": "verified",
        "evidence": "layer2_trade_selection_agent.json writes data/layer2.json and script.js reads it.",
        "notes": [
          "The exact publication responsibility split beyond the verified Layer 2 writer remains explicitly unverified."
        ]
      }
    },
    {
      "id": "master_orchestrator",
      "label": "Master Orchestrator",
      "short_label": "Master Orchestrator",
      "kind": "Workflow",
      "summary": "Sequential n8n control workflow that triggers collectors, Layer 1 agents, Layer 2, Dashboard Writer, and status publication.",
      "details": "The current export includes Layer 2 Trade Selection Agent before Dashboard Writer and then builds workflow-status.json.",
      "files": [
        "exports/master_orchestrator.json",
        "workflows/master_orchestrator.md",
        "docs/CURRENT_STATE.md"
      ],
      "verification": {
        "status": "verified",
        "evidence": "exports/master_orchestrator.json and current docs agree on the sequential execution chain.",
        "notes": []
      }
    },
    {
      "id": "workflow_status_builder",
      "label": "Workflow Status Builder",
      "short_label": "Status Builder",
      "kind": "Workflow Step",
      "summary": "Inline JS inside the Master Orchestrator that assembles the final success or failure payload.",